{
  "id": "tile-hatch",
  "title": "Tile Hatch",
  "logline": "Night water made of eleven thousand glass tiles — star glints hatch into a school, gather into one great fish, then settle again.",
  "technique": "tile-hatch-school",
  "duration": 50,
  "fps": 30,
  "width": 1920,
  "height": 1080,
  "seed": 466506,
  "tempo": {
    "bpm": 96,
    "beatsPerBar": 4
  },
  "palette": {
    "abyss": "#041018",
    "deep": "#0a1c28",
    "water": "#1a4a5c",
    "foam": "#8ec4d4",
    "glint": "#e8f4f8",
    "koi": "#c45a3a",
    "gold": "#d4a05a",
    "ink": "#061018"
  },
  "sections": [
    {
      "id": "night",
      "t0": 0,
      "t1": 7.5,
      "mood": "still-water",
      "harmony": "Em"
    },
    {
      "id": "hatch",
      "t0": 7.5,
      "t1": 15,
      "mood": "awaken",
      "harmony": "G"
    },
    {
      "id": "school",
      "t0": 15,
      "t1": 30,
      "mood": "swim",
      "harmony": "Am"
    },
    {
      "id": "leviathan",
      "t0": 30,
      "t1": 40,
      "mood": "gather",
      "harmony": "C"
    },
    {
      "id": "settle",
      "t0": 40,
      "t1": 45,
      "mood": "return",
      "harmony": "Em"
    },
    {
      "id": "title",
      "t0": 45,
      "t1": 50,
      "mood": "release",
      "harmony": "Em"
    }
  ],
  "shots": [
    {
      "id": "s0",
      "t0": 0,
      "t1": 3.75,
      "beat": 0,
      "camera": {
        "x": 0,
        "y": 0.04,
        "zoom": 1.55,
        "rot": 0.01
      },
      "subject": "water-mosaic",
      "action": "star glints on night tiles",
      "caption": ""
    },
    {
      "id": "s1",
      "t0": 3.75,
      "t1": 7.5,
      "beat": 3.75,
      "camera": {
        "x": 0,
        "y": 0.02,
        "zoom": 1.35,
        "rot": 0
      },
      "subject": "glints",
      "action": "ripples pull speculars",
      "caption": ""
    },
    {
      "id": "s2",
      "t0": 7.5,
      "t1": 12.5,
      "beat": 7.5,
      "camera": {
        "x": 0,
        "y": 0,
        "zoom": 1.22,
        "rot": 0
      },
      "subject": "hatch",
      "action": "reflections stretch and hatch",
      "caption": "The water remembers."
    },
    {
      "id": "s3",
      "t0": 12.5,
      "t1": 17.5,
      "beat": 12.5,
      "camera": {
        "x": -0.04,
        "y": 0,
        "zoom": 1.28,
        "rot": 0
      },
      "subject": "hatching-fish",
      "action": "glints become fish bodies",
      "caption": ""
    },
    {
      "id": "s4",
      "t0": 17.5,
      "t1": 25,
      "beat": 17.5,
      "camera": {
        "x": 0,
        "y": -0.02,
        "zoom": 1.12,
        "rot": 0
      },
      "subject": "school",
      "action": "twenty fish lock and swim",
      "caption": "Tiles that learned to swim."
    },
    {
      "id": "s5",
      "t0": 25,
      "t1": 30,
      "beat": 25,
      "camera": {
        "x": 0.06,
        "y": 0,
        "zoom": 1.18,
        "rot": 0
      },
      "subject": "school",
      "action": "school crosses the frame",
      "caption": ""
    },
    {
      "id": "s6",
      "t0": 30,
      "t1": 36.25,
      "beat": 30,
      "camera": {
        "x": 0,
        "y": 0,
        "zoom": 1.35,
        "rot": 0
      },
      "subject": "koi",
      "action": "reform as one great fish",
      "caption": "One shape from many."
    },
    {
      "id": "s7",
      "t0": 36.25,
      "t1": 40,
      "beat": 36.25,
      "camera": {
        "x": 0,
        "y": 0.02,
        "zoom": 1.22,
        "rot": 0
      },
      "subject": "koi",
      "action": "hold then release",
      "caption": ""
    },
    {
      "id": "s8",
      "t0": 40,
      "t1": 45,
      "beat": 40,
      "camera": {
        "x": 0,
        "y": 0,
        "zoom": 1.08,
        "rot": 0
      },
      "subject": "mosaic",
      "action": "tiles settle back to water",
      "caption": ""
    },
    {
      "id": "s9",
      "t0": 45,
      "t1": 50,
      "beat": 45,
      "camera": {
        "x": 0,
        "y": 0,
        "zoom": 1,
        "rot": 0
      },
      "subject": "title",
      "action": "end card",
      "caption": ""
    }
  ],
  "events": [
    {
      "t": 3.75,
      "kind": "whoosh",
      "id": "ripple"
    },
    {
      "t": 7.5,
      "kind": "pluck",
      "id": "first-hatch"
    },
    {
      "t": 10,
      "kind": "whoosh",
      "id": "hatch-surge"
    },
    {
      "t": 12.5,
      "kind": "bell",
      "id": "fish-a"
    },
    {
      "t": 13.75,
      "kind": "bell",
      "id": "fish-b"
    },
    {
      "t": 15,
      "kind": "impact",
      "id": "school-lock"
    },
    {
      "t": 18.75,
      "kind": "whoosh",
      "id": "swim-1"
    },
    {
      "t": 25,
      "kind": "whoosh",
      "id": "cross"
    },
    {
      "t": 27.5,
      "kind": "pluck",
      "id": "turn"
    },
    {
      "t": 30,
      "kind": "whoosh",
      "id": "gather"
    },
    {
      "t": 32.5,
      "kind": "impact",
      "id": "koi-lock"
    },
    {
      "t": 36.25,
      "kind": "bell",
      "id": "hold"
    },
    {
      "t": 40,
      "kind": "whoosh",
      "id": "settle"
    },
    {
      "t": 45,
      "kind": "impact",
      "id": "end"
    }
  ],
  "acceptance": {
    "maxDeadAirSec": 1.5,
    "beatToleranceSec": 0.04,
    "thumbnailReadable": true,
    "zeroExternalAssets": true
  }
}