{
  "id": "mosaic-flock",
  "title": "Mosaic Flock",
  "logline": "A glass-and-gold mosaic that never stayed a wall — tiles lift, swim as fish, rise as cranes, then pin themselves into night.",
  "technique": "glass-tile-flock",
  "duration": 66,
  "fps": 30,
  "width": 1920,
  "height": 1080,
  "seed": 7297564,
  "tempo": {
    "bpm": 96,
    "beatsPerBar": 4
  },
  "palette": {
    "abyss": "#07090e",
    "deep": "#121826",
    "glass": "#9eb8c8",
    "gold": "#d4a85a",
    "foam": "#e8e4dc",
    "dusk": "#3a4a62",
    "dawn": "#c8a078",
    "night": "#0a0e18"
  },
  "sections": [
    {
      "id": "wall",
      "t0": 0,
      "t1": 5,
      "mood": "still",
      "harmony": "Dm"
    },
    {
      "id": "fish",
      "t0": 5,
      "t1": 26.25,
      "mood": "swim",
      "harmony": "Bb"
    },
    {
      "id": "birds",
      "t0": 26.25,
      "t1": 42.5,
      "mood": "lift",
      "harmony": "F"
    },
    {
      "id": "night",
      "t0": 42.5,
      "t1": 56.25,
      "mood": "constellate",
      "harmony": "C"
    },
    {
      "id": "release",
      "t0": 56.25,
      "t1": 66,
      "mood": "disperse",
      "harmony": "D"
    }
  ],
  "shots": [
    {
      "id": "s0",
      "t0": 0,
      "t1": 5,
      "beat": 0,
      "camera": {
        "x": -0.04,
        "y": 0.1,
        "zoom": 3.35,
        "rot": 0.025
      },
      "subject": "mosaic-wall",
      "action": "gold vein detail hold",
      "caption": ""
    },
    {
      "id": "s1",
      "t0": 5,
      "t1": 11.25,
      "beat": 5,
      "camera": {
        "x": 0,
        "y": 0.02,
        "zoom": 1.28,
        "rot": 0
      },
      "subject": "tiles",
      "action": "assemble into fish",
      "caption": "The wall remembers the sea."
    },
    {
      "id": "s2",
      "t0": 11.25,
      "t1": 18.75,
      "beat": 11.25,
      "camera": {
        "x": 0.02,
        "y": -0.02,
        "zoom": 1.42,
        "rot": 0
      },
      "subject": "fish-flock",
      "action": "assemble + swim",
      "caption": ""
    },
    {
      "id": "s3",
      "t0": 18.75,
      "t1": 26.25,
      "beat": 18.75,
      "camera": {
        "x": -0.04,
        "y": 0,
        "zoom": 1.35,
        "rot": 0
      },
      "subject": "fish-flock",
      "action": "swim across",
      "caption": "Tiles learned to swim."
    },
    {
      "id": "s4",
      "t0": 26.25,
      "t1": 33.75,
      "beat": 26.25,
      "camera": {
        "x": 0,
        "y": -0.04,
        "zoom": 1.22,
        "rot": 0
      },
      "subject": "fish",
      "action": "dissolve to cranes",
      "caption": ""
    },
    {
      "id": "s5",
      "t0": 33.75,
      "t1": 42.5,
      "beat": 33.75,
      "camera": {
        "x": 0.02,
        "y": -0.06,
        "zoom": 1.38,
        "rot": 0
      },
      "subject": "crane-flock",
      "action": "fly flock across",
      "caption": "Then they learned to fly."
    },
    {
      "id": "s6",
      "t0": 42.5,
      "t1": 50,
      "beat": 42.5,
      "camera": {
        "x": 0,
        "y": -0.02,
        "zoom": 1.18,
        "rot": 0
      },
      "subject": "sky",
      "action": "dissolve day to night",
      "caption": ""
    },
    {
      "id": "s7",
      "t0": 50,
      "t1": 56.25,
      "beat": 50,
      "camera": {
        "x": 0,
        "y": 0,
        "zoom": 1.48,
        "rot": 0
      },
      "subject": "constellation",
      "action": "stars lock figure",
      "caption": "Night kept the pattern."
    },
    {
      "id": "s8",
      "t0": 56.25,
      "t1": 62.5,
      "beat": 56.25,
      "camera": {
        "x": 0,
        "y": 0,
        "zoom": 1.22,
        "rot": 0
      },
      "subject": "constellation",
      "action": "spiral dissolve",
      "caption": ""
    },
    {
      "id": "s9",
      "t0": 62.5,
      "t1": 66,
      "beat": 62.5,
      "camera": {
        "x": 0,
        "y": 0,
        "zoom": 1,
        "rot": 0
      },
      "subject": "title",
      "action": "end card hold",
      "caption": ""
    }
  ],
  "events": [
    {
      "t": 5,
      "kind": "whoosh",
      "id": "lift"
    },
    {
      "t": 11.25,
      "kind": "impact",
      "id": "fish-lock"
    },
    {
      "t": 12.5,
      "kind": "pluck",
      "id": "fin-a"
    },
    {
      "t": 13.75,
      "kind": "pluck",
      "id": "fin-b"
    },
    {
      "t": 15,
      "kind": "pluck",
      "id": "fin-c"
    },
    {
      "t": 18.75,
      "kind": "whoosh",
      "id": "swim-push"
    },
    {
      "t": 26.25,
      "kind": "whoosh",
      "id": "to-birds"
    },
    {
      "t": 33.75,
      "kind": "impact",
      "id": "crane-lock"
    },
    {
      "t": 36.25,
      "kind": "bell",
      "id": "wing-1"
    },
    {
      "t": 38.75,
      "kind": "bell",
      "id": "wing-2"
    },
    {
      "t": 42.5,
      "kind": "whoosh",
      "id": "dusk"
    },
    {
      "t": 50,
      "kind": "impact",
      "id": "constellation-lock"
    },
    {
      "t": 51.875,
      "kind": "bell",
      "id": "star-a"
    },
    {
      "t": 53.75,
      "kind": "bell",
      "id": "star-b"
    },
    {
      "t": 56.25,
      "kind": "whoosh",
      "id": "spiral"
    },
    {
      "t": 62.5,
      "kind": "impact",
      "id": "end"
    }
  ],
  "acceptance": {
    "maxDeadAirSec": 1.5,
    "beatToleranceSec": 0.04,
    "thumbnailReadable": true,
    "zeroExternalAssets": true
  }
}